{
  "_meta": {
    "generated_at": "2026-04-30T14:00:00Z",
    "valid_until": "2026-05-01T02:00:00Z",
    "pack_name": "Sales / RevOps Briefing",
    "schema_version": "1.0.0"
  },
  "new_customers": [
    { "company": "Northwind Logistics", "arr": 240000, "owner": "Casey Singh", "closed_at": "2026-04-28", "tier": "mid_market" },
    { "company": "Helios Robotics", "arr": 84000, "owner": "Jordan Lee", "closed_at": "2026-04-25", "tier": "smb" }
  ],
  "churned_customers": [
    { "company": "OldCo Industries", "arr": 60000, "churned_at": "2026-04-22", "reason": "consolidation" }
  ],
  "at_risk_accounts": [
    { "company": "Stellar Inc", "arr": 320000, "owner": "Casey Singh", "risk_factor": "low product usage", "next_action": "QBR scheduled 2026-05-05" }
  ],
  "top_deals_in_flight": [
    { "company": "Quantum Health", "stage": "negotiation", "amount": 480000, "owner": "Pat Quinn", "expected_close": "2026-05-15" }
  ],
  "quota_attainment": { "current_quarter": { "target": 4000000, "closed": 2640000, "pct": 66 } },
  "corrections": [
    { "wrong": "Northwind is a prospect", "right": "Northwind closed 2026-04-28 ($240K ARR).", "context": "recent close" }
  ]
}
